{
  "schema_version": 1,
  "record_type": "harness-artifact-admission",
  "harness": {
    "name": "openworker",
    "declared_version": "0.0.0"
  },
  "artifact": {
    "packaging": "oci-distribution",
    "ref": "ghcr.io/sempersupra/model-spelunker-harness-openworker@sha256:e8c9da992ee4c1ce3934e6e9874c3129c4b00cec38428ed9cf1fe47190a9fe83",
    "digest": "sha256:e8c9da992ee4c1ce3934e6e9874c3129c4b00cec38428ed9cf1fe47190a9fe83",
    "build_receipt_digest": "sha256:f88c696f292c44963acfe6a810e17abafd09fb3c002582ecf3cce7e2818e72d6"
  },
  "admission": {
    "state": "BUILD_ADMITTED",
    "target": "linux-x86_64-python3",
    "checks": [
      {
        "name": "embedded-build-receipt",
        "result": "PASS",
        "evidence": null
      },
      {
        "name": "payload-hashes",
        "result": "PASS",
        "evidence": null
      },
      {
        "name": "offline-wheel-install",
        "result": "PASS",
        "evidence": null
      },
      {
        "name": "coworker-import-surface",
        "result": "PASS",
        "evidence": null
      },
      {
        "name": "openworker-cli-help",
        "result": "PASS",
        "evidence": null
      }
    ]
  }
}
